{
  "schemaVersion": 1,
  "feature": {
    "id": 5082138340491264,
    "name": "Programmatic scroll promises",
    "chromeStatusUrl": "https://chromestatus.com/feature/5082138340491264",
    "category": "JavaScript",
    "blinkComponent": "Blink>Scroll",
    "featureType": "Chromium catches up",
    "ownerEmail": "mustaq@chromium.org",
    "shippingMilestone": 150,
    "platforms": [
      "desktop",
      "android",
      "webview"
    ],
    "summary": "Makes Element/Window scroll methods (scroll, scrollTo, scrollBy, scrollIntoView) return Promises that resolve on scroll completion, with the resolved value indicating whether the scroll was interrupted."
  },
  "launchEvents": [
    {
      "eventId": "150:Enabled by default:5082138340491264",
      "milestone": 150,
      "category": "Enabled by default"
    }
  ],
  "evidenceCutoff": "2026-07-19T12:00:00Z",
  "phaseReview": {
    "intake": {
      "status": "supported",
      "finding": "Problem is real, long-standing and recurring: developers cannot reliably know when a programmatic smooth-scroll has completed. The request dates to 2017 in CSSWG issue #1562, was formally resolved by the CSS WG in 2018 ('RESOLVED: add returning a promise to all scroll functions'), and has a Chromium tracking bug since 2018-08-08 (migrated from crbug 872341). The ChromeStatus entry, explainer and motivation articulate the same problem with concrete use cases (disable UI during scroll, highlight/focus after scroll, E2E test sequencing). Feature type is recorded as 'Chromium catches up' even though no engine had previously shipped it; this is a classification oddity rather than an intake defect.",
      "evidenceIds": [
        "S1",
        "S2",
        "S3",
        "S11"
      ],
      "limitations": "ChromeStatus record carries no feature_notes, measurement, adoption_expectation or availability_expectation; the intake documents the problem well but records no user-research or survey basis."
    },
    "incubation": {
      "status": "partial",
      "finding": "Standards-level incubation is solid: the design was debated and resolved in CSSWG (#1562, then the follow-up #12495), with developer support in the GitHub thread (multiple +1s and use cases: analytics after scroll, focus-after-scroll, parallax). The explainer states goals, non-goals and contrasts the scrollend-event alternative. However ecosystem/customer research is thin: no developer survey, no interview cohort, no adjacent-platform/native analysis, and the explainer's Stakeholder Feedback/Opposition section is 'TBD'. Demand is inferred from a standards thread plus later case-study evidence, not from a validated research instrument.",
      "evidenceIds": [
        "S2",
        "S3",
        "S5",
        "S18"
      ],
      "limitations": "No documented user research, survey or representative-cohort evidence; 'why browser intervention' is asserted via the CSSWG resolution rather than independently validated."
    },
    "prototype": {
      "status": "partial",
      "finding": "A working implementation existed behind the runtime flag ProgrammaticScrollPromise (Element.idl June 2025, Window.idl July 2025) with a CodePen demo and WPT tests added February 2026. The implementation is substantial and includes deliberate code-health refactors and a dedicated scrollIntoView resolver. But there is no documented external developer trial, no friction log, no framework/server integration spike and no recruited cohort; prototype evidence is almost entirely internal CL history.",
      "evidenceIds": [
        "S11",
        "S20",
        "S23",
        "S24",
        "S26"
      ],
      "limitations": "No public developer-trial findings, integration evidence or representative-user testing; 'works behind a flag' is not the same as 'validated by representative developers'."
    },
    "developerTrials": {
      "status": "not-relevant",
      "finding": "The feature did not run a public developer trial or recruit a cohort. Rationale: it is a backward-compatible additive change (return type undefined->Promise with a never-reject design to preserve 'ignore the return value' callers), judged low-risk enough to ship via behind-flag implementation plus WPT rather than a public dev trial. 'Not-relevant' here means the phase was deliberately bypassed for a compat-safe addition; it is NOT an assertion that the design was untested (WPT and behind-flag builds were used).",
      "evidenceIds": [
        "S1",
        "S9",
        "S23",
        "S24"
      ],
      "limitations": "Skipping a trial means early real-world feedback (which later surfaced a scrollIntoView correctness issue in stable) was not collected before launch."
    },
    "wideReview": {
      "status": "partial",
      "finding": "Mixed but net-positive review state. WebKit formally supports (position: support label by 2026-04-09). A Mozilla engineer (emilio) reviewed and the spec PR #12355 was merged with Mozilla approval, but Mozilla's formal standards position is still open with no label ('No signal'). Web-developer signal is recorded as Positive via #1562. WPT coverage exists. Gaps: the TAG review (#1210, filed March 2026) is still 'Pending' with no TAG position, and the follow-up normative issue #12495 (how to mark completion vs interruption, and scrollIntoView multi-scroller interruption semantics) was still open and labeled 'Needs Edits'/'Needs Testcase' at ship time.",
      "evidenceIds": [
        "S4",
        "S5",
        "S6",
        "S7",
        "S8",
        "S3"
      ],
      "limitations": "'Support' position is not implementation; Mozilla 'No signal' is not neutral-positive; TAG review had not concluded; the normative detail other engines must implement was not yet final."
    },
    "experiment": {
      "status": "not-relevant",
      "finding": "No Origin Trial was run. Rationale: the change is additive and backward-compatible (no behavior removal, no new permissions, no resource cost), so no field uncertainty was judged to require real-origin/user conditions. The Intent to Prototype lists no OT plan. 'Not-relevant' means an OT was not warranted for this compat-safe addition, not that real-origin behavior was validated.",
      "evidenceIds": [
        "S1",
        "S9"
      ],
      "limitations": "Had an OT been used, the scrollIntoView multi-scroller resolution path could have been exercised on real sites before stable."
    },
    "prepareToShip": {
      "status": "supported",
      "finding": "Intent to Ship posted 2026-03-31 received three LGTMs within a day (Alex Russell, Daniel Bratell, Dan Clark) by 2026-04-01. Spec PR merged, WPT coverage in place, Element/Window/scrollIntoView all implemented, Finch name set (ProgrammaticScrollPromise), rollout plan 'enabled for all users', breaking_change=false, enterprise_impact none. The enable CL landed on main and the team resolved a use-after-free (deferred promise resolution) before stable, including an M149-branch backport. Compat analysis is present and explicit (avoid rejection; one documented async-throw edge case).",
      "evidenceIds": [
        "S10",
        "S11",
        "S4",
        "S20",
        "S22",
        "S24"
      ],
      "limitations": "Enablement assets were minimal at gate time (release-notes paragraph + CodePen); a milestone ambiguity (M149 backport vs ChromeStatus M150) was not reconciled in public materials."
    },
    "release": {
      "status": "supported",
      "finding": "Shipped on schedule: Chrome 150 beta 2026-06-02, stable 2026-06-30, listed in the Chrome 150 release notes (DOM and HTML) with ChromeStatus and spec links. MDN per-method pages document the Promise return value and the 'interrupted' property, MDN browser-compat-data carries a Chrome 150 entry, and a caniuse page exists for the Window scroll promise subfeature. Default-enabled on desktop, Android and WebView (iOS null).",
      "evidenceIds": [
        "S12",
        "S13",
        "S14",
        "S16",
        "S17",
        "S1"
      ],
      "limitations": "Communication was release-notes-level: no dedicated developer.chrome.com/web.dev deep-dive or official demo beyond the CodePen; caniuse extraction of exact version numbers was inconsistent across retrievals (Chrome 150 corroborated by four independent sources)."
    },
    "adoption": {
      "status": "unknown",
      "finding": "Feature is only ~3 weeks past stable at the evidence cutoff, so durable adoption cannot be assessed. No public use-counter/usage data is available yet, and no framework, library or build-tool integration was found. The only substantive independent developer evidence is a July 2026 ICS MEDIA article that implements real use cases (table-of-contents highlight after scroll, guided tour, interruption handling) and a community MDN doc-report flagging the missing return-value documentation. No attributable production deployment evidence exists. Adoption must remain unknown; it must not be inferred from shipment or from one article.",
      "evidenceIds": [
        "S18",
        "S15"
      ],
      "limitations": "No usage metrics, no framework integration, no partner/production case study with denominator; too early to score."
    },
    "support": {
      "status": "partial",
      "finding": "The tracking bug is active and comprehensive and the team fixed a late UAF and built a dedicated scrollIntoView resolver (bug 399877341). However early external evidence shows quality friction: an independent developer reported in Chrome 150.0.7871.46 stable that scrollIntoView() resolves its Promise before scrolling has completed (the hardest multi-scroller case and the subject of the still-open spec issue #12495). Known edge cases include the async-throw regression for malformed scroll calls. No public support-issue dashboard or recurrence metrics are visible.",
      "evidenceIds": [
        "S11",
        "S18",
        "S21",
        "S22",
        "S23",
        "S5"
      ],